,title
31742,analisis proses restatement dalam rangka penerapan pp nomor 71 tahun 2010 tentang standar akuntansi pemerintah berbasis akrual pada laporan keuangan konsolidasi kabupaten sekadau tahun 2014.
31593,the determinants of emerging market exchange-rate exposure
41001,economic impact of port sectors on south african economy: an input-output analysis
34661,leverage effect and its causality in the korea composite stock price index
28872,macroeconomic stabilization and economic growth in the transition to a really functioning market economy
7937,symposium 2: minimum wage setting under fair work australia: back to the future?
7144,stationarity in the prices of energy commodities. a nonparametric approach
21298,"values, authenticity, and responsible leadership"
38503,exploring relationship between crude oil price volatility and stock indices movement using wavelet analysis: evidence from india and china
7264,"personality, social norms, and sexual harassment in the workplace"
16814,notes and comments: a note on existence and uniqueness of equilibrium points for concave n-person games.
29399,what great financial advisers and physicians have in common
13527,property tax planning
41582,civil-service pension schemes around the world
18784,the collingham or scarle boring
37995,tendenzen zur weiterentwicklung der sozialversicherung
7346,influence of multinational corporations on consumption culture
7404,"book review:the growth of literature. volume i the ancient literature of europe h. munro chadwick, n. kershaw chadwick"
38384,a new approach for the knowledge assessment of countries
36481,business strategies for an enterprise mobility solutions provider
11462,quandaries and virtues@@@quandaries and virtues: against reductivism in ethics
2699,factors of students’ entrepreneurial potential development in russia. on the example of the penza region
45264,the timing and value of forecast and recommendation revisions
2124,an analysis of effectiveness of china's monetary policy in recent years
8677,how non-ricardian is the life-cycle model?
3851,free-standing ambulatory surgery centers and hospital surgery volume
30555,industry community and core industry detection base on electricity consumption data
16382,[invalidity as the result of industrial injuries in the miners of the lvov-volinsky coal basin and ways of its reduction].
5362,лесоресурсный потенциал - точка роста экономики региона // forest resource potential as a new impetus for regional economic growth
24770,the creeping conformity—and potential risks—of contemporary urbanism
9482,swedish match company in central europe between the wars : internal power struggle between former competitors - solo v. swedish match
13271,dinamika pemanfaatan ruang berbasis kearifan lokal di kabupaten buleleng provinsi bali
20020,investigating water access constraints and land-based livelihoods for empowerment of rural farming women and implication for household food security : the case study of three irrigation schemes in limpopo.
33524,methods of avoiding international double taxation: statement of the problem
41880,"commentary: competitiveness in a globalised world: michael porter on the microeconomic foundations of the competitiveness of nations, regions, and firms"
8802,"women workers, working girls and the women's movement: gender, oppourtunity and morality in twentieth century brazil"
27342,predicting overflow in an emergency department
29097,u.s. outlook on the framework proposal (powerpoint presentation)
13132,a study of the impact mechanism of capital endowment on the employment of rural migrant labors
42491,banks' backtesting exceptions during the covid-19 crash: causes and consequences
11368,momentum trading behavior in the fx market: evidence from japanese retail investors
28870,"аксиологически-институциональное развитие
сбережений и проблема частной собственности в
условиях становления рыночной экономики"
23001,implications of country-level decisions on the specification of crown cover in the definition of forests for land area eligible for afforestation and reforestation activities in the cdm
12009,internal prisoner's dilemma vindicated
40182,international organizations as information providers: how investors and governments utilize optimistic imf forecasts
14176,methods for the determination of the efficiency of foreign trade
1151,from a socialism of migrants towards a europe of mobilities
19352,elimination method of multi-criteria decision analysis (mcda): a simple methodological approach for assessing agricultural sustainability
11785,types of entrepreneurial action and societal provision for the future: an inquiry
9724,the effects of social support exchanges with adult children on the quality of rural and urban single household elderly: data comparison survey of the elderly in 2011 and 2017
41248,the abandoned stakeholders: pharmaceutical companies and research participants
41181,financialization and transformation of the french state in the early 17th century
20682,reaksi pasar terhadap peristiwa pengumuman cash dividend pada industri manufaktur yang terdaftar di bei
44778,culture and customs of afghanistan
4404,information goods vs. industrial goods: cost structure and competition
7628,"book review: manpower: rehabilitation, sheltered workshops, and the disadvantaged: an exploration in manpower policy"
2474,volatility-managed portfolio: does it really work?
6987,the transformation of the european economic constitution
44328,advanced topics in evidence-based urologic oncology: economic analysis.
39618,"michael torigian, every factory a fortress: the french labor movement in the age of ford and hitler. athens, ohio: ohio university press, 1999. ix + 260 pp. $44.95 cloth."
34291,a monte carlo filtering application for systematic sensitivity analysis of computable general equilibrium results
18616,the housing market and housing finance under liberalization in india
4283,is there a long run relationship between population growth and living standards? the case of india-a re-examination
5305,focus in corn and soybean markets shifts away from crop size
25476,"the origins of the modern financial revolution: responses to impediments from church and state in western europe, 1200 - 1600"
26636,transportation in developing countries: special reference to kenya
12784,political and economic conditions in east asia under the influece of the european regime in the 16th–17th century
36734,"financial development, market deregulation and growth: evidence from china"
6157,der langfristige zusammenhang zwischen demographischen und budgetären variablen
26680,"war games: the secret world of the creators, players, and policy makers rehearsing world war iii today"
10737,what information matters to investors at different stages of a firm's life cycle?
41403,the natural beverages of the iranian cuisine
21061,do state-owned enterprises underperform compared to privately owned companies? an examination of the largest polish enterprises
27770,"savings and loan demand for liquid assets: theory, evidence and implications for policy"
5891,ponera coarctata
16181,fdi: a response to global and local variables
13242,"nanotech sector urges trump epa to delay, revise tsca reporting rule"
29854,"multi-player gaming system for from the off-site location, methods, and products"
2756,the changing human experience of work
39506,the vital statistics of wealth and poverty
23005,essays on russian economic geography: measuring spatial inefficiency
20525,case problems in finance - third edition
41291,microwave communications in india [microbusiness]
27752,research on problems and regulation measures in domestic folk lending
9993,award given by the vernon prize committee for volume 26 of jpam
14043,market opening and locus of power in korea’s channels of distribution
1161,the half-life & after-life of new media
12713,national water policy charter unveiled
6473,introducing individual savings accounts to sustain the development of italian smes
23096,"the fees -> savings link, or purchasing fifty pounds of pasta"
14428,setting the record straight on the business activity tax simplification act
17316,bank funding costs and capital structure
14152,schedular and global systems of income taxation - the equity dimension
46920,municipal golf in england: exploring performance indicators for local authorities
30099,the economic value of user tracking for publishers
2507,quantities and values of selected forest foods harvested by eight villages adjacent to natural woodlands in the four ecological zones of rural swaziland
20546,the triggers and clustering properties of merger waves
47388,cape working on new guidance for evaluating program o&s costs
7900,the equalization price: a measure of consumer-perceived brand equity
1044,the social costs of gun ownership revisited
14637,"analysis of foreign countries’ digital economy programs (argentina, brazil, india and mexico)"
510,menschen mit hohen einkommen leben länger
37091,reflections on customers’ primary role in markets
28613,optimal selling mechanisms for multiproduct monopolists: incentive compatibility in the presence of budget constraints
18153,does intensive coaching reduce school dropout?
31430,"governance, culture and democracy: institutions and economic development of eu member states"
17591,influences and countermeasures of financial crisis in real estate industry of china
33651,the study on attribute and application of fair value
26839,transferability of migration licences and the distribution of potential rents
31102,an evaluation of evidence from the united
35242,regulatory freedom under gats: financial services sector
41887,inclusive urban development and poverty reduction: learning from innovative practice
35991,"financial sector assets, real innovation and economic growth: assessment of interconnection and influence of regulatory instruments"
7882,an economic education program that makes cents.
24071,"""making science understandable"" : divulgació científica i mediació editorial: el cas de the wisdom of the body de walter b. cannon (1871-1945)"
35797,chapter 13. central banks: independence versus dependence
26020,the green movement in west germany
25317,"financial literacy, financial behavior, self-efficacy, and financial health among malaysian households: the mediating role of money attitudes"
36781,modell schweden ein vorbild? licht- und schattenseiten der schwedischen arbeitsmarkt- und beschäftigungspolitik
45009,using floor price mechanisms to promote carbon capture and storage (ccs) investment and co2 abatement
46444,"the reconstruction of the international economy, 1945-1960"
27775,morphological characteristics and prevention of tooth enamel demineralization during orthodontic treatment with non-removable appliances
16641,the corporate social responsibility of family businesses: an international approach
40518,the employment creation impact of the addis ababa integrated housing program draft
43373,challenges in quantitative equity management
7372,"beknopte handleiding bij de leergang van het handelsrecht. met een voorwoord van m.rené goris, 3e éd."
14264,"the welfare wall, reservation wages, and labour force attachment"
38380,lesson from the trenches: debtor educator in theory and practice
30216,underreaction to industry-wide earnings and the post-forecast revision drift
38767,"the gender wage gaps, 'sticky floors' and 'glass ceilings' of the european union"
28442,teaching third-degree price discrimination by a monopolist with linear demands
8047,"consumption, supply of labor and search activity in an intertemporal perspective"
5504,the lexical stock of hungarian
28675,incentive policy and supplies of energy sources
6331,do firms exploit mispricing of their stock in their financing decisions? evidence from the share lending market
38615,antioxidative defense and gut microbial changes under pollution stress in carassius gibelio from bucharest lakes
9836,"role of ict institutions in enhancing productivity, knowledge and innovativeness of farmers: a case study of isro village resource centers"
6148,"energy consumption, survey data and the prediction of industrial production in italy"
7013,international conference on the employment of older workers
44683,"flexibility and specialization in question; birth, growth and death rates of cambridge new technology-based firms 1988-92"
981,does experience of banking crises affect trust in banks?
41896,angelonia angustifolia
7936,mit der scheinstabilität der ungerechtigkeit ist es nun vorbei: zur verleihung der dag-hammarskjöld-ehrenmedaille an gro harlem brundtland (17.november 1991)
28263,prospects for an afta-cer free trade agreement
37400,london prices of drugs.—april 22
13287,bilateral advance pricing agreements (bapa) in transfer pricing taxation
11609,estimating technical efficiency and bootstrapping malmquist indices
3298,"observations on financial stability concerns for monetary policymakers: remarks at the shanghai advanced institute of science, beijing, china, august 31, 2016"
41078,the asset pricing system
30633,restructuring performance of debt restructuring listed companies and securities market regulation
28190,strikes and labor organization in hybrid regimes
23481,"effects of microencapsulated organic acid and their salts on growth performance, immunity, and disease resistance of pacific white shrimp litopenaeus vannamei"
8075,types of rationality and economic action
9832,on strategic quantity bidding in multiple unit auctions
28765,trade theory in a developing country context: the case of south korean industry 1973-1980
19640,agency law and contract formation
37938,the need for vertical envelopment
7172,information management in financial markets: implications for stock momentum and volatility
25481,determinación del costo social medio del egresado universitario
19193,주택특성가격이론의 발전 모색
7690,asia and truman's fourth point
21498,the use of genetic algorithm in economic optimization of hybrid system to electrify distant areas iran
26472,economic growth and emu: a note on uk membership
47030,"""hevrat haovdim"" and ""bank hapoalim"" / הככול הבנקים בנק הפועלים?"
41521,energy inputs and greenhouse gas emissions associated with small-scale farmer sugarcane cropping systems and subsequent bioethanol production in japan
32516,verbunden über generationen: struktur und ausmaß der intergenerationalen einkommensmobilität in deutschland
18506,vwap execution as an optimal strategy
29434,how the united states viewed germany and japan in 1941
4906,paa8 cost of refractory severe persistent asthma in czech republic—cost of illness study
33259,řízení výkonnosti zpracovatelských podniků v čr s důrazem na nefinanční aspekty podnikání
21170,on property right system reform of village small-scale water conservancy in jiangsu province
14397,confidence sets in regressions with highly serially correlated regressors
23181,selected innovative approaches in the waste tyres management
1864,agricultural land distribution in vietnam: emerging issues and policy implications
21384,"disequilibrium macroeconomics, money as a buffer stock and the estimation of money demand"
30597,some flaws in the draft 1995 rpa program
20070,agricultural aid to indochina
204,"core, periphery, exchange rate regimes, and globalization"
60,does crime lower growth? evidence from colombia
3761,assessing the impact of improved agricultural technologies on household income in rural mozambique
30381,gas industry in the former soviet union: international effects of its further economic transformation
1734,"upper cumberland human resource agency. cumberland area rural transit system, algood, tennessee (draft)"
5916,"modelo de gestion aplicando a los procesos administrativos de la unión provincialde organizaciones campesinas de manabi""upocam"" del canton jipijapa."
46096,1068. m. w. to sir william rowan hamilton
28717,analisis price reversal di bursa efek indonesia : studi kasus indeks bisnis 27 periode januari 2015 - desember 2016
36606,liquidity constraints and investment return behaviour
10634,coming soon : tax on lottery and gambling winnings : budget 2011
41107,social protection design and implementation in ethiopia prospects for a more inclusive approach
19623,seminario sobre investigacion regional en ciencias sociales
32315,utility of wealth and relative risk aversion: operationalization and estimation
3714,cornus stolonifera
25857,foreign aid allocation tactics and democratic change in africa
7823,corruption as an alternative to limit pricing
6994,a different approach to information management by exceptions (toward the prevention of another enron)
14860,les organisations productrices d'incompetence
6719,sustainable development of agriculture & environmental protection
14322,centro universitário de brasília (uniceub)
14536,"implementation of cooperation agreement between the ministry of internal affairs, police, attorney general office (ago) in handling and crime of corruption in indonesia"
18267,strengthening coherence between social protection and agricultural interventions - the case of mali
27065,methodological aspects of the population and housing census of 1971
33582,in reference to soft skills development in the course of cross-cultural business communication
34769,whose power? whose and which duties? pension fund investments and fiduciary-related duties in the united states and india
44249,centralization versus delegation and the value of communication
8634,pre-procedure angina frequency predicts cost-effectiveness of coronary revascularization
30526,effect of u.s. monetary policy on emerging sovereign cds-bond market
36585,some major issues in economics and insurance developments (insurance premiums: economic factors for insurance pricing policies)
10392,letters to the editor
2417,investment and demand uncertainty
23531,an exploratory study of parental christmas request communications
39366,an estimated cost of lost climate regulation services caused by thawing of the arctic cryosphere.
43868,put your money where your mouth is: a model of certification with informed finance
29216,[the cities and urbanization in the migratory movements between 1968 and 1975].
33704,accountability in the context of transgovernmental networks: a conceptual approach
34608,development of transport in conditions of transformation of economic systems
46071,risk taking in local governments’ financial investment making
31502,análise exergética de válvulas redutoras de pressão visando cogeração: estudo de caso em uma indústria de celulose
6620,the drivers of financial globalization
14036,"domenico demarco, l'uomo, lo storico"
10001,a positive agenty theory : the nash game between deterrence systems and reward systems
47448,"on emissions trading, toxic debt and the australian power market"
10053,how does institutional quality moderate the influence of financial development on environmental pollution? evidence from g20 countries
17178,in the house but out of the household? why congress needs to codify a substantial support test for courts to use when calculating a debtor’s household size
3240,en ny landsbygdspolitik? en granskning av två parlamentariska landsbygdskommittéers slutbetänkanden
11824,"weak convergence of tree methods, to price options on defaultable assets"
16069,the response of low-income households to income losses from disability
28369,the problem of an autonomous bureaucracy in transition economies: lessons from the american experience
31907,islamic economics and a third fundamental theorem of welfare economics
26948,vosper fast patrol boats for the trinidad and tobago coast guard
19167,the belgian presidency 2001
36871,a century of macro-financial linkages
371,a new institutional financial analysis on sunk cost relevance
1255,implementasi corporate social responsibility pada pt. perkebunan nusantara iv (persero)
10983,how pharmaceuticals cut direct & indirect costs of therapy.
9555,fifty years of management at the harvard forest.
40301,do financial aspects affect care transitions in long-term care systems? a systematic review
36216,a retrospect and prospect on the development of china's stock market
9181,fiscal policy under deflationary gap and long-run stagnation: reinterpretation of keynesian multipliers
36949,"discussion of ordering of risks and ruin probabilities by f. broeckx, m. goovaerts and f. de vylder"
10759,the clinical and psychopathological implications in the forms of hyperhistaminosis
15454,skirtingą darbo patirtį turinčių asmenųsocializacijos organizacijoje ypatumai
32936,"an inquiry into the stability of islamic financial services institutions in terms of volatility, risk and correlations: a case study of malaysia employing m-garch t-dcc and modwt wavelet approaches"
44994,the social production of gentility and capital in early modern england : the newtons of lincolnshire
42875,zero-sum two-person games
46400,multimedia and the crisis economy in japan
46009,intergenerational relationships among migrant families in europe
36627,from sars to china's rural worker's social security problem
40809,theoretical framework on future knowledge-based economy
18115,the indices of сore inflation in russia
4251,usaf to make historic change in method of overall defense suppression policy
17442,ifo konjunkturtest juni 2001 in kürze
36927,economic analysis and the third sector overview of economic analysis in relation to the third sector
34177,undominated vcg redistribution mechanisms
46116,twin deficits and sustainability
2322,considerations about deepening the accounting system reform of state-owned institution——based on the comparison with the
24401,book review: policy and performance: agricultural and development in post-independence india
15850,on credit frictions as labor-income taxation
36103,hypoxia expert discusses critical science aspects of gulf 'dead zone'
14339,국민연금의 개혁과 경로연금의 과제
21253,gewerbemieten trotzen der corona-krise
7099,plaidoyer pour l'utopie
37956,"models for anticipating non-motorized travel choices, and role of the built environment"
45256,normative inference in efficient markets
40203,china’s quest for grand strategy
33139,complex and concurrent negotiations for multiple interrelated e-markets
8697,operation management of rural banks of local government in the emerging market: an assessment of agency conflict or social responsibility
2741,manifesting stories: the progression of comics from print to web to print
1383,inflationssorgen in der brd
15778,agricultural diversification and economic growth in ecuador
667,cryptocurrency market structure: connecting emotions and economics
38825,"wimps, yobs and game busters"
40952,"economic growth, transport accessibility and regional equity impacts of high-speed railways in italy: ten years ex post evaluation and future perspectives"
12109,energy efficiency and co2 emission abatement technology
31511,oversea settlement. migration from the united kingdom to the dominions.
34007,the use of the signal approach to development of early warning indicators of financial turmoil in russia
1254,"the restoration of industry, crafts, trade and the demographic recovery of čukarica municipality 1919-1929"
9571,impact of corporate financial services in banking sector
31217,a re-examination of the market reaction to failed mergers
7732,united kingdom pig production 1967 – 1978
14318,5 regnum transilvanum: the rise of the congregational regime
16037,achieving zero hunger in india: challenges and policies
42977,economic evidence on the existence of collusion: reconciling antitrust law with oligopoly theory
27361,"the army you have: the determinants of military mechanization, 1979–2001"
15724,hydrogen production from nuclear energy: comparative cost assessment
39498,how transparency may corrupt â experimental evidence from asymmetric public goods games
5692,neofuedalism as territorial and economic governance: post-socialist russia's experience
24531,information acquisition and use by networked players
47081,cost efficiency evaluation based on a data envelopment analysis approach by considering undesirable outputs on the basis of the semi-disposability assumption
14398,factors influencing farmers' willingness to purchase farm prices index insurance
24647,the economics of sport in asia: editors' overview
24053,mother tongue and marriage: the french and english in canada.
37348,implementasi resolusi micro conflict berbasis alternative dispute resolution (studi peran mediasi di pusat pelayanan terpadu perempuan dan anak korban kekerasan ‘rekso dyah utami’ yogyakarta)
33989,perspectives of the accession of the czech republic to the euro area in terms of the price level convergence
25277,subsides in indian economy and their role in balancing fiscal deficit
29014,resource externalities and the persistence of heterogeneous pricing behavior in an energy commodity market
21225,mental framing by consequence thinking: its effects on judgements of gender-based employment selection
17181,[working conditions and morbidity rate in employers at the south-east railway transport].
30779,"assessment of rural farming households wtp for fertilizers and agrochemicals in kwawara state, nigeria"
3689,data for: urban growth tendency of electrical cables in the costa rican metropolitan area
11997,increasing importance of genetic algorithms in science and technology: linear trends over the period from year 1989 to 2022
15544,understanding the entrepreneur: an index of entrepreneurial success
39918,estimators of the regression parameters of the zeta distribution
12241,formulation of american foreign policy
13515,valuation of wind power distributed generation by using longstaff–schwartz option pricing method
