,title
22623,"environmental justice and the long-term impacts of large dam projects : a case study of communities displaced by the inanda dam, durban."
12665,corrigenda: introduction to the economics of religion
37292,innovation and economic growth : an empirical investigation of european countries
17179,import trade mark translation in cultural context
45850,english bards and german sages
7057,economies of size in auto body manufacture
2573,issues for international development agencies.
15538,community action and the poor: influence vs. social control in a new york city community.@@@subsidizing the poor: an evaluation of the boston housing authority program.
246,maximizing the probability of realizing profit targets versus maximizing expected profits: a reconciliation to resolve an agency problem
995,thought on imposition of social security tax in china
4791,questions for new single-payer advocates
41549,a critical evaluation of agricultural credit financing in nigeria
46183,a realist inquiry to identify the contribution of lean six sigma to person-centred care and cultures
47387,prospects and challenges of business tourism: a case of mauritius
34801,competing autonomy claims and the changing grammar of global politics
40428,voluntary environmental agreements in developing countries: the colombian experience
38683,carta de josé manuel naredo a la comisaria de medio ambiente de la unión europea sobre el phn
14289,multivariate analysis of variance applied to 3g mobile market segmentation : the innovator theory
44976,chapter 5 : results 5 . 1 contribution and extraction pattern of selected non-timber forest products from achanakmar-amarkantak biosphere reserve by communities living in and around of biosphere reserve
5260,identification of a new traf6 inhibitor for the treatment of hepatocellular carcinoma
16680,analisis del fenómeno de migración y posibles soluciones en el municipio de belalcázar caldas
4403,latin america in the south-south cooperation against the background of globalization controversies
12874,economics and law: two cultures in tension
4231,university-industry cooperation in research and development
17910,a study on the development and socio-cultural impact of tourism real estate in the ancient town of dali
9538,payday loans and globalization in the age of the internet – policy recommendations
35939,la política económica burguesa frente a la crisis
23054,inter-regional dependence of j-reit stock prices: a heteroscedasticity-robust time series approach
5407,the ecb and the euro--the first 6 years: a view from the ecb
17432,the dynamic effects of fiscal policy shocks in pakistan
46737,"equality, adequacy, and educational policy"
34070,exploring nutrient recovery from hydroponics in urban agriculture: an environmental assessment
13164,portofolio investasi pengusaha diy
34565,identifying the dynamic home market effect in a three-country model
7218,on the characteristics of the rational spirit of chinese socialist market economy
33825,stamford journal of economics
47300,the county fair cyber loss distribution: drawing inferences from insurance prices
38240,the state in burma
7797,"comparative analysis of financial performance before and after cooperation with health bpjs as a provider of health services in 2011-2018 (study at rsi muhammadiyah sumberrejo, bojonegoro)"
38521,the model optimization method of time-of-use price
24643,can the report of the ‘five presidents’ save the euro?
39603,cleo research paper series
10470,extrinsic uncertainty revisited
15499,dod opposes measure: congress close to passing legislation imposing landmine moratorium
4005,a multilevel analysis of the effects of neighbourhood income inequality on individual self-rated health in hong kong.
5517,debt security of ukraine
21231,modern construction economics
7873,a multi-criteria and multi-agent framework for supporting complex decision-making processes
35226,2030 target for energy efficiency and emission reduction in the eu paper industry
24863,strategies to revitalize garuda indonesia route profitability to improve financial performance
6229,"the problem of docket control: a response to ""reassessing the allocation of judicial business between state and federal courts"""
43695,the continental divide? economic exposure to brexit in regions and countries on both sides of the channel
12577,intraday liquidity provision by trader types in a limit order market: evidence from taiwan index futures
29069,economics and chrematistics in the economic thought of the stoic philosophy
45168,the growth and distribution of population in guangzhou city in 1982-2000
24953,the decline of the industrial city: the limits of neoliberal urban regeneration
38660,the economic principles of telephone rates under a budgetary constraint
33689,opec and the world oil outlook : rebound of the exporters?
46347,beyond the fcn treaty: japanese multinationals under title vii
36668,on the equilibrium price set of a continuous perturbation of exchange economies
25509,use of device does not ensure compliance with needlestick rule
37698,the eu regulatory framework for gm foods in relation to bee products
28511,inter divisional study of economic development of eastern u p with special reference to human development indices 1990 2000
3056,the rediscovery of the division of labor
41800,estimating the cost related to surveillance of colorectal cancer in a french population
23594,dampak investasi terhadap ketimpangan kesempatan kerja regional di indonesia
36106,equilibrium trust
855,features of the globalization process in the world economy
37540,the medieval `cycle' as history play: an approach to the wakefield plays
21304,quantitative risk assessment of exposure to airborne asbestos in an office building
20231,response to an optimistic viewpoint
21974,quantitative trading through random perturbation q-network with nonlinear transaction costs
43768,the evolution of university responses to financial reduction.
16473,short-term leaders should make long-term appointments
26696,china's energy mix adjustment in terms of strategy
34858,the effect of business plan competitions on entrepreneurial intention and behavior
5136,"games, information, and evidence production: with application to english legal history"
25874,"property rights, institutions and forest resources management in developing countries"
19210,"rationality and freedom, weber and beyond"
1139,corrosion on a substrate field of the invention
44506,"the anatomy of political and social change: turkish parties, parliaments, and elections"
17751,a procedure for evaluating development potential in the area of production capacity
